{
  "$schema": "https://json-schema.org/draft/2020-12/schema",
  "$id": "https://knowledge.pneuma.dev/schemas/source/meeting-v1.schema.json",
  "title": "Pneuma Meeting Source v1",
  "type": "object",
  "additionalProperties": false,
  "required": ["schema", "provider", "meeting_id", "title", "started_at", "participants", "segments"],
  "properties": {
    "schema": {"const": "pneuma.source.meeting/v1"},
    "provider": {"enum": ["zoom", "mock"]},
    "meeting_id": {"type": "string", "minLength": 1},
    "title": {"type": "string", "minLength": 1},
    "started_at": {"type": "string", "format": "date-time"},
    "ended_at": {"type": ["string", "null"], "format": "date-time"},
    "timezone": {"type": ["string", "null"]},
    "owner_participant_ids": {
      "type": "array",
      "items": {"type": "string", "minLength": 1},
      "uniqueItems": true
    },
    "participants": {
      "type": "array",
      "items": {"$ref": "#/$defs/participant"}
    },
    "agenda": {"type": "array", "items": {"type": "string"}},
    "segments": {
      "type": "array",
      "minItems": 1,
      "items": {"$ref": "#/$defs/segment"}
    },
    "metadata": {"type": "object"}
  },
  "$defs": {
    "participant": {
      "type": "object",
      "additionalProperties": false,
      "required": ["participant_id", "display_name"],
      "properties": {
        "participant_id": {"type": "string", "minLength": 1},
        "display_name": {"type": "string", "minLength": 1},
        "email": {"type": ["string", "null"]}
      }
    },
    "segment": {
      "type": "object",
      "additionalProperties": false,
      "required": ["segment_id", "speaker_id", "started_at", "text"],
      "properties": {
        "segment_id": {"type": "string", "minLength": 1},
        "speaker_id": {"type": "string", "minLength": 1},
        "started_at": {"type": "string", "format": "date-time"},
        "ended_at": {"type": ["string", "null"], "format": "date-time"},
        "text": {"type": "string", "minLength": 1}
      }
    }
  }
}
