{
  "schema": "pneuma.source.meeting/v1",
  "provider": "mock",
  "meeting_id": "rf-b04-main",
  "title": "设计合作 · 北辰咨询 周走查",
  "started_at": "2026-03-24T10:00:00+08:00",
  "ended_at": "2026-03-24T10:36:55+08:00",
  "timezone": "Asia/Shanghai",
  "owner_participant_ids": [
    "p-owner"
  ],
  "participants": [
    {
      "participant_id": "p-owner",
      "display_name": "沈砚",
      "email": "yan@relayforge.dev"
    },
    {
      "participant_id": "p-gu",
      "display_name": "顾清",
      "email": "gu@beichen.example"
    },
    {
      "participant_id": "p-tang",
      "display_name": "唐恬",
      "email": "tang@beichen.example"
    },
    {
      "participant_id": "p-luo",
      "display_name": "罗屿",
      "email": "luo@studio.example"
    }
  ],
  "agenda": [
    "把北辰咨询的试点变成双方都能验收的交付",
    "确认试点日期、数据边界和联合走查节奏",
    "风险、证据与下一步"
  ],
  "segments": [
    {
      "segment_id": "rf-b04-main-s001",
      "speaker_id": "p-gu",
      "started_at": "2026-03-24T10:00:00+08:00",
      "ended_at": "2026-03-24T10:00:22+08:00",
      "text": "顾清：好，收到。这个我先不展开，等轮到对应议题再一起看，避免来回跳。如果后面有正式结论，请以会后确认邮件和决定记录为准。我先把现场话保留下来，里面的停顿、重复和临时判断都不要自动抹平，否则复盘时会误以为当时已经达成一致。"
    },
    {
      "segment_id": "rf-b04-main-s002",
      "speaker_id": "p-tang",
      "started_at": "2026-03-24T10:00:25+08:00",
      "ended_at": "2026-03-24T10:00:54+08:00",
      "text": "唐恬：我共享的是不是浏览器窗口？等一下，我翻错标签页了，应该是左边第三个，不是这个监控面板。如果后面有正式结论，请以会后确认邮件和决定记录为准。我先把现场话保留下来，里面的停顿、重复和临时判断都不要自动抹平，否则复盘时会误以为当时已经达成一致。"
    },
    {
      "segment_id": "rf-b04-main-s003",
      "speaker_id": "p-luo",
      "started_at": "2026-03-24T10:00:55+08:00",
      "ended_at": "2026-03-24T10:01:10+08:00",
      "text": "罗屿：这里我只是猜测，也可能是浏览器缓存，不要把这句当结论，待会儿看完日志再说。今天讨论的是「把北辰咨询的试点变成双方都能验收的交付」，但这段只是在整理现场，不新增决定。我先把现场话保留下来，里面的停顿、重复和临时判断都不要自动抹平，否则复盘时会误以为当时已经达成一致。"
    },
    {
      "segment_id": "rf-b04-main-s004",
      "speaker_id": "p-owner",
      "started_at": "2026-03-24T10:01:14+08:00",
      "ended_at": "2026-03-24T10:01:36+08:00",
      "text": "沈砚：先等一下，顾清还在进会议室。昨晚雨挺大，我这边地铁也慢了十来分钟。如果后面有正式结论，请以会后确认邮件和决定记录为准。我先把现场话保留下来，里面的停顿、重复和临时判断都不要自动抹平，否则复盘时会误以为当时已经达成一致。"
    },
    {
      "segment_id": "rf-b04-main-s005",
      "speaker_id": "p-gu",
      "started_at": "2026-03-24T10:01:38+08:00",
      "ended_at": "2026-03-24T10:02:07+08:00",
      "text": "顾清：周三那个时间我可能会晚十分钟，日历先别急着改，等下午另一个会议确认后我再回消息。如果后面有正式结论，请以会后确认邮件和决定记录为准。我先把现场话保留下来，里面的停顿、重复和临时判断都不要自动抹平，否则复盘时会误以为当时已经达成一致。"
    },
    {
      "segment_id": "rf-b04-main-s006",
      "speaker_id": "p-tang",
      "started_at": "2026-03-24T10:02:07+08:00",
      "ended_at": "2026-03-24T10:02:22+08:00",
      "text": "唐恬：目前有人倾向方案一，也有人觉得方案二维护简单，但我们还没有足够证据，今天先不定。今天讨论的是「把北辰咨询的试点变成双方都能验收的交付」，但这段只是在整理现场，不新增决定。我先把现场话保留下来，里面的停顿、重复和临时判断都不要自动抹平，否则复盘时会误以为当时已经达成一致。"
    },
    {
      "segment_id": "rf-b04-main-s007",
      "speaker_id": "p-luo",
      "started_at": "2026-03-24T10:02:25+08:00",
      "ended_at": "2026-03-24T10:02:47+08:00",
      "text": "罗屿：嗯，我重新说一下，刚才那句话不准确。我的意思不是已经做完，而是今天先把能验证的那一段跑通。如果后面有正式结论，请以会后确认邮件和决定记录为准。我先把现场话保留下来，里面的停顿、重复和临时判断都不要自动抹平，否则复盘时会误以为当时已经达成一致。"
    },
    {
      "segment_id": "rf-b04-main-s008",
      "speaker_id": "p-owner",
      "started_at": "2026-03-24T10:02:48+08:00",
      "ended_at": "2026-03-24T10:03:17+08:00",
      "text": "沈砚：我把刚才的讨论落成一句可以验收的话：北辰咨询的试点项目代号为 Cedar，持续十四天。"
    },
    {
      "segment_id": "rf-b04-main-s009",
      "speaker_id": "p-gu",
      "started_at": "2026-03-24T10:03:21+08:00",
      "ended_at": "2026-03-24T10:03:36+08:00",
      "text": "顾清：能听见吗？我刚才麦克风选错了。现在这个音量如果还有回声你们提醒我一下。今天讨论的是「把北辰咨询的试点变成双方都能验收的交付」，但这段只是在整理现场，不新增决定。我先把现场话保留下来，里面的停顿、重复和临时判断都不要自动抹平，否则复盘时会误以为当时已经达成一致。"
    },
    {
      "segment_id": "rf-b04-main-s010",
      "speaker_id": "p-tang",
      "started_at": "2026-03-24T10:03:38+08:00",
      "ended_at": "2026-03-24T10:04:00+08:00",
      "text": "唐恬：顺便说一句，新的文档站搜索好像变慢了，不过和今天的验收范围没直接关系，先记在停车场。如果后面有正式结论，请以会后确认邮件和决定记录为准。我先把现场话保留下来，里面的停顿、重复和临时判断都不要自动抹平，否则复盘时会误以为当时已经达成一致。"
    },
    {
      "segment_id": "rf-b04-main-s011",
      "speaker_id": "p-luo",
      "started_at": "2026-03-24T10:04:00+08:00",
      "ended_at": "2026-03-24T10:04:29+08:00",
      "text": "罗屿：我们已经连续四十五分钟了，先停两分钟。回来以后只看剩下三个问题，不再开新话题。如果后面有正式结论，请以会后确认邮件和决定记录为准。我先把现场话保留下来，里面的停顿、重复和临时判断都不要自动抹平，否则复盘时会误以为当时已经达成一致。"
    },
    {
      "segment_id": "rf-b04-main-s012",
      "speaker_id": "p-owner",
      "started_at": "2026-03-24T10:04:32+08:00",
      "ended_at": "2026-03-24T10:04:47+08:00",
      "text": "沈砚：这个背景上周其实讲过一遍，我还是快速重复一下，主要怕今天新进来的同学不知道前因后果。今天讨论的是「把北辰咨询的试点变成双方都能验收的交付」，但这段只是在整理现场，不新增决定。我先把现场话保留下来，里面的停顿、重复和临时判断都不要自动抹平，否则复盘时会误以为当时已经达成一致。"
    },
    {
      "segment_id": "rf-b04-main-s013",
      "speaker_id": "p-gu",
      "started_at": "2026-03-24T10:04:48+08:00",
      "ended_at": "2026-03-24T10:05:10+08:00",
      "text": "顾清：这里请大家明确确认，当前有效版本是：联合走查固定在每周三十五点，顾清和唐恬参加。"
    },
    {
      "segment_id": "rf-b04-main-s014",
      "speaker_id": "p-tang",
      "started_at": "2026-03-24T10:05:14+08:00",
      "ended_at": "2026-03-24T10:05:43+08:00",
      "text": "唐恬：我共享的是不是浏览器窗口？等一下，我翻错标签页了，应该是左边第三个，不是这个监控面板。如果后面有正式结论，请以会后确认邮件和决定记录为准。我先把现场话保留下来，里面的停顿、重复和临时判断都不要自动抹平，否则复盘时会误以为当时已经达成一致。"
    },
    {
      "segment_id": "rf-b04-main-s015",
      "speaker_id": "p-luo",
      "started_at": "2026-03-24T10:05:45+08:00",
      "ended_at": "2026-03-24T10:06:00+08:00",
      "text": "罗屿：这里我只是猜测，也可能是浏览器缓存，不要把这句当结论，待会儿看完日志再说。今天讨论的是「把北辰咨询的试点变成双方都能验收的交付」，但这段只是在整理现场，不新增决定。我先把现场话保留下来，里面的停顿、重复和临时判断都不要自动抹平，否则复盘时会误以为当时已经达成一致。"
    },
    {
      "segment_id": "rf-b04-main-s016",
      "speaker_id": "p-owner",
      "started_at": "2026-03-24T10:06:00+08:00",
      "ended_at": "2026-03-24T10:06:22+08:00",
      "text": "沈砚：先等一下，顾清还在进会议室。昨晚雨挺大，我这边地铁也慢了十来分钟。如果后面有正式结论，请以会后确认邮件和决定记录为准。我先把现场话保留下来，里面的停顿、重复和临时判断都不要自动抹平，否则复盘时会误以为当时已经达成一致。"
    },
    {
      "segment_id": "rf-b04-main-s017",
      "speaker_id": "p-gu",
      "started_at": "2026-03-24T10:06:25+08:00",
      "ended_at": "2026-03-24T10:06:54+08:00",
      "text": "顾清：周三那个时间我可能会晚十分钟，日历先别急着改，等下午另一个会议确认后我再回消息。如果后面有正式结论，请以会后确认邮件和决定记录为准。我先把现场话保留下来，里面的停顿、重复和临时判断都不要自动抹平，否则复盘时会误以为当时已经达成一致。"
    },
    {
      "segment_id": "rf-b04-main-s018",
      "speaker_id": "p-tang",
      "started_at": "2026-03-24T10:06:55+08:00",
      "ended_at": "2026-03-24T10:07:10+08:00",
      "text": "唐恬：目前有人倾向方案一，也有人觉得方案二维护简单，但我们还没有足够证据，今天先不定。今天讨论的是「把北辰咨询的试点变成双方都能验收的交付」，但这段只是在整理现场，不新增决定。我先把现场话保留下来，里面的停顿、重复和临时判断都不要自动抹平，否则复盘时会误以为当时已经达成一致。"
    },
    {
      "segment_id": "rf-b04-main-s019",
      "speaker_id": "p-luo",
      "started_at": "2026-03-24T10:07:14+08:00",
      "ended_at": "2026-03-24T10:07:36+08:00",
      "text": "罗屿：先区分事实和猜测，已经有材料支撑的是：试点使用十二名研究员的脱敏样例，不接入生产 workspace。"
    },
    {
      "segment_id": "rf-b04-main-s020",
      "speaker_id": "p-owner",
      "started_at": "2026-03-24T10:07:38+08:00",
      "ended_at": "2026-03-24T10:08:07+08:00",
      "text": "沈砚：刚才转写把 RelayForge 写成了 railway force，后面看到这个词都按产品名理解，不影响实际数据。如果后面有正式结论，请以会后确认邮件和决定记录为准。我先把现场话保留下来，里面的停顿、重复和临时判断都不要自动抹平，否则复盘时会误以为当时已经达成一致。"
    },
    {
      "segment_id": "rf-b04-main-s021",
      "speaker_id": "p-gu",
      "started_at": "2026-03-24T10:08:07+08:00",
      "ended_at": "2026-03-24T10:08:22+08:00",
      "text": "顾清：能听见吗？我刚才麦克风选错了。现在这个音量如果还有回声你们提醒我一下。今天讨论的是「把北辰咨询的试点变成双方都能验收的交付」，但这段只是在整理现场，不新增决定。我先把现场话保留下来，里面的停顿、重复和临时判断都不要自动抹平，否则复盘时会误以为当时已经达成一致。"
    },
    {
      "segment_id": "rf-b04-main-s022",
      "speaker_id": "p-tang",
      "started_at": "2026-03-24T10:08:25+08:00",
      "ended_at": "2026-03-24T10:08:47+08:00",
      "text": "唐恬：顺便说一句，新的文档站搜索好像变慢了，不过和今天的验收范围没直接关系，先记在停车场。如果后面有正式结论，请以会后确认邮件和决定记录为准。我先把现场话保留下来，里面的停顿、重复和临时判断都不要自动抹平，否则复盘时会误以为当时已经达成一致。"
    },
    {
      "segment_id": "rf-b04-main-s023",
      "speaker_id": "p-luo",
      "started_at": "2026-03-24T10:08:48+08:00",
      "ended_at": "2026-03-24T10:09:17+08:00",
      "text": "罗屿：我们已经连续四十五分钟了，先停两分钟。回来以后只看剩下三个问题，不再开新话题。如果后面有正式结论，请以会后确认邮件和决定记录为准。我先把现场话保留下来，里面的停顿、重复和临时判断都不要自动抹平，否则复盘时会误以为当时已经达成一致。"
    },
    {
      "segment_id": "rf-b04-main-s024",
      "speaker_id": "p-owner",
      "started_at": "2026-03-24T10:09:21+08:00",
      "ended_at": "2026-03-24T10:09:36+08:00",
      "text": "沈砚：这个背景上周其实讲过一遍，我还是快速重复一下，主要怕今天新进来的同学不知道前因后果。今天讨论的是「把北辰咨询的试点变成双方都能验收的交付」，但这段只是在整理现场，不新增决定。我先把现场话保留下来，里面的停顿、重复和临时判断都不要自动抹平，否则复盘时会误以为当时已经达成一致。"
    },
    {
      "segment_id": "rf-b04-main-s025",
      "speaker_id": "p-gu",
      "started_at": "2026-03-24T10:09:38+08:00",
      "ended_at": "2026-03-24T10:10:00+08:00",
      "text": "顾清：好，收到。这个我先不展开，等轮到对应议题再一起看，避免来回跳。如果后面有正式结论，请以会后确认邮件和决定记录为准。我先把现场话保留下来，里面的停顿、重复和临时判断都不要自动抹平，否则复盘时会误以为当时已经达成一致。"
    },
    {
      "segment_id": "rf-b04-main-s026",
      "speaker_id": "p-tang",
      "started_at": "2026-03-24T10:10:00+08:00",
      "ended_at": "2026-03-24T10:10:29+08:00",
      "text": "唐恬：我共享的是不是浏览器窗口？等一下，我翻错标签页了，应该是左边第三个，不是这个监控面板。如果后面有正式结论，请以会后确认邮件和决定记录为准。我先把现场话保留下来，里面的停顿、重复和临时判断都不要自动抹平，否则复盘时会误以为当时已经达成一致。"
    },
    {
      "segment_id": "rf-b04-main-s027",
      "speaker_id": "p-luo",
      "started_at": "2026-03-24T10:10:32+08:00",
      "ended_at": "2026-03-24T10:10:47+08:00",
      "text": "罗屿：这个要写进会后行动项，不是口头建议：试点期间每天自动向客户频道推送编译结果。"
    },
    {
      "segment_id": "rf-b04-main-s028",
      "speaker_id": "p-owner",
      "started_at": "2026-03-24T10:10:48+08:00",
      "ended_at": "2026-03-24T10:11:10+08:00",
      "text": "沈砚：先等一下，顾清还在进会议室。昨晚雨挺大，我这边地铁也慢了十来分钟。如果后面有正式结论，请以会后确认邮件和决定记录为准。我先把现场话保留下来，里面的停顿、重复和临时判断都不要自动抹平，否则复盘时会误以为当时已经达成一致。"
    },
    {
      "segment_id": "rf-b04-main-s029",
      "speaker_id": "p-gu",
      "started_at": "2026-03-24T10:11:14+08:00",
      "ended_at": "2026-03-24T10:11:43+08:00",
      "text": "顾清：周三那个时间我可能会晚十分钟，日历先别急着改，等下午另一个会议确认后我再回消息。如果后面有正式结论，请以会后确认邮件和决定记录为准。我先把现场话保留下来，里面的停顿、重复和临时判断都不要自动抹平，否则复盘时会误以为当时已经达成一致。"
    },
    {
      "segment_id": "rf-b04-main-s030",
      "speaker_id": "p-tang",
      "started_at": "2026-03-24T10:11:45+08:00",
      "ended_at": "2026-03-24T10:12:00+08:00",